{"schemaVersion":"data.harness/v1","receiptId":"receipt-1","actionId":"act-1","actionDigest":"sha256:aaaaaaaaaaaaaaaaaaaaaaaaaaaaaaaaaaaaaaaaaaaaaaaaaaaaaaaaaaaaaaaa","idempotencyKey":"request-1:update","state":"executed","startedAt":"2026-08-27T00:01:00Z","completedAt":"2026-08-27T00:01:01Z","sourceVersion":"8","policyDecisionId":"decision-1","auditDigest":"sha256:bbbbbbbbbbbbbbbbbbbbbbbbbbbbbbbbbbbbbbbbbbbbbbbbbbbbbbbbbbbbbbbb","compensationOf":null}
